id, type, name, status , description, epic, startTime, duration, endTime,
1, Task, Поесть, NEW, Принять пищу, -, 05.07.2022 12:51, 30, 05.07.2022 13:21
2, Task, Поспать, DONE, Хорошенько выспаться, -, 05.07.2022 13:51, 600, 05.07.2022 23:51
3, EpicTask, Закончить учебу, IN_PROGRESS, Получить сертификат обучения, -, 05.07.2022 23:51, 404320, 12.04.2023 18:31
7, EpicTask, Сменить работу, NEW, Начать работать Java разработчиком, -, null, 0, null
4, SubTask, Сдать все спринты, NEW, Вовремя выполнить ТЗ, 3, 05.07.2022 23:51, 150000, 18.10.2022 03:51
5, SubTask, Сдать дипломный проект, DONE, Сделать дипломный проект, 3, 18.10.2022 03:51, 250000, 09.04.2023 18:31
6, SubTask, Сдать 5й спринт, NEW, Сделать ТЗ, 3, 09.04.2023 18:31, 4320, 12.04.2023 18:31

1, 2, 3, 4, 5, 6, 7